{
  "id": "sindy",
  "name": "Sindy",
  "pronunciation": "sˈɪndi",
  "base": "anime-600x800",
  "rig": "svg",
  "identity": ["body/anime-slim", "face/anime-oval", "eyes/anime-large", "brows/anime-soft", "mouth/anime", "nose/anime-line"],
  "palette": {
    "skin.base": "#fde8dc",
    "skin.shade": "#f4c9b8",
    "skin.line": "#d99a86",
    "skin.blush": "#fb7185",
    "hair.base": "#0d9488",
    "hair.light": "#2dd4bf",
    "hair.tip": "#38bdf8",
    "hair.dark": "#0b5d57",
    "hair.shine": "#a5f3fc",
    "hair.deep": "#0891b2",
    "eyes.white": "#ffffff",
    "eyes.iris-top": "#0c4a6e",
    "eyes.iris-mid": "#0284c7",
    "eyes.iris-low": "#5ee7f9",
    "eyes.pupil": "#082f49",
    "eyes.glint": "#a5f3fc",
    "eyes.highlight": "#ffffff",
    "eyes.lid-shadow": "#0c4a6e",
    "eyes.lash": "#1e2a3a",
    "brows.color": "#0f4c48",
    "mouth.line": "#9a4552",
    "mouth.inside": "#8f2a3c",
    "mouth.tongue": "#e8798d",
    "mouth.teeth": "#ffffff",
    "mouth.outline": "#6b1f2c"
  },
  "moods": {
    "neutral": { "brow": 0, "browTilt": 0, "eye": 1, "squint": 0.05, "happyEyes": 0, "smile": 0.35, "mouthOpen": 0, "blush": 0.35, "pupil": 1 },
    "happy": { "brow": 0.35, "browTilt": 0.1, "eye": 0.95, "squint": 0.3, "happyEyes": 0, "smile": 0.85, "mouthOpen": 0.15, "blush": 0.6, "pupil": 1 },
    "joy": { "brow": 0.5, "browTilt": 0.15, "eye": 1, "squint": 0, "happyEyes": 1, "smile": 1, "mouthOpen": 0.55, "blush": 0.8, "pupil": 1 },
    "surprised": { "brow": 1, "browTilt": 0.2, "eye": 1.12, "squint": 0, "happyEyes": 0, "smile": 0, "mouthOpen": 0.45, "blush": 0.4, "pupil": 0.8 },
    "thinking": { "brow": 0.15, "browTilt": -0.35, "eye": 0.85, "squint": 0.2, "happyEyes": 0, "smile": 0.05, "mouthOpen": 0, "blush": 0.3, "pupil": 1 },
    "concerned": { "brow": 0.1, "browTilt": 0.7, "eye": 0.95, "squint": 0.1, "happyEyes": 0, "smile": -0.25, "mouthOpen": 0, "blush": 0.3, "pupil": 1 },
    "smug": { "brow": -0.1, "browTilt": -0.2, "eye": 0.8, "squint": 0.35, "happyEyes": 0, "smile": 0.7, "mouthOpen": 0, "blush": 0.5, "pupil": 1 },
    "wink": { "brow": 0.3, "browTilt": 0.1, "eye": 1, "squint": 0.2, "happyEyes": 0, "smile": 0.9, "mouthOpen": 0.2, "blush": 0.7, "pupil": 1, "winkR": 1 }
  },
  "temperament": {},
  "seed": 11,
  "look": "hoodie",
  "voice": "voice.json",
  "lexicon": "lexicon.json",
  "disclosure": "Sindy is an AI-voiced virtual presenter"
}
